{
  "identity": {
    "run_id": "patch-webhook_skailr_rep3_74c45cf6d2",
    "series_id": "series_359ba37f53d6",
    "task_id": "patch-webhook",
    "task_version": "1",
    "arm": "skailr",
    "skailr_sha": "sha_v1_11_0_aaaaaaa",
    "skailr_version": "1.11.0",
    "fixture_sha": "fixsha_patch-webhook",
    "timestamp": "2026-07-01T03:29:00.000Z"
  },
  "environment": {
    "claude_code_version": "2.1.224",
    "model_id": "claude-sonnet-4-6-20260201",
    "os": "linux",
    "container": null,
    "node_version": "22.22.2"
  },
  "outcome": {
    "solved": false,
    "termination_reason": "finish",
    "visible_tests": {
      "passed": 6,
      "failed": 0,
      "total": 6
    },
    "hidden_tests": {
      "passed": 6,
      "failed": 4,
      "total": 10
    },
    "regression": {
      "passed": 5,
      "failed": 3,
      "total": 8
    },
    "critical_failures": []
  },
  "quality": {
    "quality_score": 55,
    "subscores": {
      "functional": 55,
      "regression": 55,
      "security": 55,
      "static": 55,
      "scope": 55,
      "maintainability": 55
    }
  },
  "time": {
    "wall_clock_s": 245,
    "claude_active_s": 208,
    "time_to_first_edit_s": 8,
    "grader_s": 1.5
  },
  "usage": {
    "tokens": {
      "input": 2352,
      "output": 784,
      "cache_read": 588,
      "cache_create": 294
    },
    "by_model": {
      "claude-sonnet-4-6-20260201": {
        "input": 2352,
        "output": 784,
        "cache_read": 588,
        "cache_create": 294
      }
    },
    "by_source": {
      "main": {
        "input": 1680,
        "output": 560,
        "cache_read": 420,
        "cache_create": 210
      },
      "subagent": {
        "input": 672,
        "output": 224,
        "cache_read": 168,
        "cache_create": 84
      },
      "auxiliary": {
        "input": 0,
        "output": 0,
        "cache_read": 0,
        "cache_create": 0
      }
    },
    "by_agent": {
      "sub-worker": {
        "input": 672,
        "output": 224,
        "cache_read": 168,
        "cache_create": 84
      }
    }
  },
  "cost": {
    "cost_reported_usd": 0.0421,
    "cost_reconstructed_usd": 0.022942,
    "pricing_table_version": "2026-08"
  },
  "trajectory": {
    "model_requests": 3,
    "tool_calls": 4,
    "failed_tool_calls": 0,
    "retries": 0,
    "compactions": 1
  },
  "code": {
    "files_read": 4,
    "files_edited": 2,
    "lines_added": 30,
    "lines_removed": 5,
    "diff_bytes": 900
  },
  "process": {
    "test_executions": 2,
    "test_failures": 1,
    "repair_loops": 1
  },
  "skailr_diagnostics": {
    "agents_spawned": 3,
    "inter_agent_messages": 12,
    "blockers": 1,
    "contract_events": 2,
    "gate_failures": 1,
    "validator_findings": 2
  },
  "failure_stage": "implementation"
}
