{
  "identity": {
    "run_id": "patch-webhook_baseline_rep2_0e655a10ca",
    "series_id": "series_1355e0a7d637",
    "task_id": "patch-webhook",
    "task_version": "1",
    "arm": "baseline",
    "skailr_sha": null,
    "skailr_version": null,
    "fixture_sha": "fixsha_patch-webhook",
    "timestamp": "2026-07-01T00:03:00.000Z"
  },
  "environment": {
    "claude_code_version": "2.1.224",
    "model_id": "claude-sonnet-4-5-20250929",
    "os": "linux",
    "container": null,
    "node_version": "22.22.2"
  },
  "outcome": {
    "solved": false,
    "termination_reason": "wall_clock_kill",
    "visible_tests": {
      "passed": 3,
      "failed": 3,
      "total": 6
    },
    "hidden_tests": {
      "passed": 6,
      "failed": 4,
      "total": 10
    },
    "regression": {
      "passed": 5,
      "failed": 3,
      "total": 8
    },
    "critical_failures": []
  },
  "quality": {
    "quality_score": 55,
    "subscores": {
      "functional": 55,
      "regression": 55,
      "security": 55,
      "static": 55,
      "scope": 55,
      "maintainability": 55
    }
  },
  "time": {
    "wall_clock_s": 372.5,
    "claude_active_s": 317,
    "time_to_first_edit_s": null,
    "grader_s": 1.5
  },
  "usage": {
    "tokens": {
      "input": 1596,
      "output": 532,
      "cache_read": 399,
      "cache_create": 200
    },
    "by_model": {
      "claude-sonnet-4-5-20250929": {
        "input": 1596,
        "output": 532,
        "cache_read": 399,
        "cache_create": 200
      }
    },
    "by_source": {
      "main": {
        "input": 1140,
        "output": 380,
        "cache_read": 285,
        "cache_create": 143
      },
      "subagent": {
        "input": 456,
        "output": 152,
        "cache_read": 114,
        "cache_create": 57
      },
      "auxiliary": {
        "input": 0,
        "output": 0,
        "cache_read": 0,
        "cache_create": 0
      }
    },
    "by_agent": {
      "sub-worker": {
        "input": 456,
        "output": 152,
        "cache_read": 114,
        "cache_create": 57
      }
    }
  },
  "cost": {
    "cost_reported_usd": 0.0198,
    "cost_reconstructed_usd": 0.013638,
    "pricing_table_version": "2026-08"
  },
  "trajectory": {
    "model_requests": 3,
    "tool_calls": 4,
    "failed_tool_calls": 0,
    "retries": 1,
    "compactions": 0
  },
  "code": {
    "files_read": 4,
    "files_edited": 2,
    "lines_added": 30,
    "lines_removed": 5,
    "diff_bytes": 900
  },
  "process": {
    "test_executions": 2,
    "test_failures": 1,
    "repair_loops": 1
  },
  "skailr_diagnostics": null,
  "failure_stage": "budget_timeout"
}
