{
  "identity": {
    "run_id": "program-rbac_baseline_rep4_dd6a07423d",
    "series_id": "series_1355e0a7d637",
    "task_id": "program-rbac",
    "task_version": "1",
    "arm": "baseline",
    "skailr_sha": null,
    "skailr_version": null,
    "fixture_sha": "fixsha_program-rbac",
    "timestamp": "2026-07-01T02:05:00.000Z"
  },
  "environment": {
    "claude_code_version": "2.1.224",
    "model_id": "claude-sonnet-4-5-20250929",
    "os": "linux",
    "container": null,
    "node_version": "22.22.2"
  },
  "outcome": {
    "solved": true,
    "termination_reason": "finish",
    "visible_tests": {
      "passed": 6,
      "failed": 0,
      "total": 6
    },
    "hidden_tests": {
      "passed": 10,
      "failed": 0,
      "total": 10
    },
    "regression": {
      "passed": 8,
      "failed": 0,
      "total": 8
    },
    "critical_failures": []
  },
  "quality": {
    "quality_score": 56,
    "subscores": {
      "functional": 56,
      "regression": 56,
      "security": 56,
      "static": 56,
      "scope": 56,
      "maintainability": 56
    }
  },
  "time": {
    "wall_clock_s": 372,
    "claude_active_s": 316,
    "time_to_first_edit_s": 8,
    "grader_s": 1.5
  },
  "usage": {
    "tokens": {
      "input": 1764,
      "output": 588,
      "cache_read": 441,
      "cache_create": 221
    },
    "by_model": {
      "claude-sonnet-4-5-20250929": {
        "input": 1764,
        "output": 588,
        "cache_read": 441,
        "cache_create": 221
      }
    },
    "by_source": {
      "main": {
        "input": 1260,
        "output": 420,
        "cache_read": 315,
        "cache_create": 158
      },
      "subagent": {
        "input": 504,
        "output": 168,
        "cache_read": 126,
        "cache_create": 63
      },
      "auxiliary": {
        "input": 0,
        "output": 0,
        "cache_read": 0,
        "cache_create": 0
      }
    },
    "by_agent": {
      "sub-worker": {
        "input": 504,
        "output": 168,
        "cache_read": 126,
        "cache_create": 63
      }
    }
  },
  "cost": {
    "cost_reported_usd": 0.0421,
    "cost_reconstructed_usd": 0.015073,
    "pricing_table_version": "2026-08"
  },
  "trajectory": {
    "model_requests": 3,
    "tool_calls": 4,
    "failed_tool_calls": 0,
    "retries": 0,
    "compactions": 0
  },
  "code": {
    "files_read": 4,
    "files_edited": 2,
    "lines_added": 30,
    "lines_removed": 5,
    "diff_bytes": 900
  },
  "process": {
    "test_executions": 2,
    "test_failures": 0,
    "repair_loops": 0
  },
  "skailr_diagnostics": null,
  "failure_stage": "none"
}
